<?xml version="1.0" encoding="UTF-8"?>
<xs:schema xmlns:xs="http://www.w3.org/2001/XMLSchema">
	<xs:element name="list">
		<xs:complexType>
			<xs:sequence>
				<xs:element name="node" minOccurs="0" maxOccurs="unbounded">
					<xs:complexType>
						<xs:sequence>
							<xs:element name="requires" minOccurs="0" maxOccurs="unbounded">
								<xs:complexType>
									<xs:attribute name="nodeId" type="xs:integer" use="required" />
								</xs:complexType>
							</xs:element>
						</xs:sequence>
						<xs:attribute name="id" type="xs:integer" use="required" />
						<xs:attribute name="name" type="xs:string" use="required" />
						<xs:attribute name="sector" type="xs:string" use="required" />
						<xs:attribute name="tier" type="xs:integer" use="optional" />
						<xs:attribute name="type" use="required">
							<xs:simpleType>
								<xs:restriction base="xs:token">
									<xs:enumeration value="START" />
									<xs:enumeration value="SMALL" />
									<xs:enumeration value="NOTABLE" />
									<xs:enumeration value="KEYSTONE" />
									<xs:enumeration value="ACTIVE_SKILL" />
									<xs:enumeration value="MASTER" />
									<xs:enumeration value="FUNCTION" />
								</xs:restriction>
							</xs:simpleType>
						</xs:attribute>
						<xs:attribute name="cost" type="xs:integer" use="optional" default="1" />
						<xs:attribute name="x" type="xs:decimal" use="optional" />
						<xs:attribute name="y" type="xs:decimal" use="optional" />
						<!-- Centre of the circle the node sits on; a link to a node on the same circle is drawn as an arc. -->
						<xs:attribute name="orbitX" type="xs:decimal" use="optional" />
						<xs:attribute name="orbitY" type="xs:decimal" use="optional" />
						<xs:attribute name="effect" type="xs:string" use="optional" />
						<xs:attribute name="description" type="xs:string" use="optional" />
						<!-- Themed glyph the web planner draws on the node (and in its ring's socket for a notable), e.g. "hammer"; none = picked by stat. -->
						<xs:attribute name="icon" type="xs:string" use="optional" />
						<xs:attribute name="skillId" type="xs:integer" use="optional" />
						<!-- A level, or "auto": the highest level of the skill whose magicLevel the character has reached. -->
						<xs:attribute name="skillLevel" use="optional">
							<xs:simpleType>
								<xs:union memberTypes="xs:positiveInteger">
									<xs:simpleType>
										<xs:restriction base="xs:string">
											<xs:enumeration value="auto" />
										</xs:restriction>
									</xs:simpleType>
								</xs:union>
							</xs:simpleType>
						</xs:attribute>
					</xs:complexType>
				</xs:element>
			</xs:sequence>
			<!-- Raised by every admin editor save. The game client caches the tree by version (and hash) and fetches it again when either changes. -->
			<xs:attribute name="version" type="xs:nonNegativeInteger" use="optional" default="0" />
		</xs:complexType>
	</xs:element>
</xs:schema>